category,title,url
plan,"AI로 더 똑똑하게 페르소나와 저니맵 만드는 법 13분 2025.07.10. AI는 우리의 업무를 더 효율적으로 만들어 주지만, 실제 UX 리서치와 분석을 통해 얻는 핵심 인사이트를 완전히 대체할 수는 없습니다. 저는 UX 리서치 분야에서 20년 넘게 일해왔는데요, 처음에는 AI를 리서치 실무에 접목하는 것에 대해 다소 회의적이었습니다. 하지만 실제로 ChatGPT 같은 생성형 AI 도구들을 사용해 보니, 그 유용성은 기대 이상이었죠. 제가 이 글을 쓰게 된 이유는, 지난 1년간 다양한 프롬프트 조합을 실험해 보면서 기존 자료에서는 잘 다루지 않았던 표현 방식과 구성의 차이를 활용해, 꽤 효과적인 접근법을 발견했기 때문입니다.",https://yozm.wishket.com/magazine/detail/3230/
plan,"AI 시대 기획자가 GPT로 타깃 고객 분석하는 법 6분 2025.07.07. AI를 업무에 능숙하게 쓴다고 해서 항상 높은 효율이 보장되는 것은 아니다. 때로는 기획자의 직관력이나 빠른 대응력이 업무에 더 큰 도움을 줄 때도 있다. 그래서 어떤 업무를 할 때, 어떻게 AI와 협력해야 더 만족스러운 결과를 얻을 수 있을지는 기획자로서 늘 고민되는 지점이다. 이번 글에서는 범용적이면서도 무료로 사용할 수 있는 ChatGPT, Grok, Perplexity를 이용해, 타깃 고객 세그먼트를 분석할 때 어떻게 사용하면 좋을지 살펴보았다.",https://yozm.wishket.com/magazine/detail/3222/
plan,"PRD 중심으로 AI 에이전트와 제품 개발하기 11분 2025.07.07. AI는 더욱 발전해, 이제는 PRD만 정확하게 써 내려갈 수 있다면 제품을 개발할 수 있는 시대에 도착해 버렸습니다. 물론 “생성형 AI 시대에 PRD도 AI에 맡기면 되는 게 아니냐?”라는 질문이 나올 수도 있고, 또 여러 사람이 실제 PRD를 작성하는 프롬프팅을 공개하고 있기도 합니다. 하지만 저는 PRD 작성을 AI에게 맡기지는 않습니다. 물론 어느 파트의 유즈 케이스나 예외 케이스를 잡을 때는 사용하고 있지만, 본론을 작성하는 데에는 AI를 '필요로 하지 않습니다'. 이번 글에서는 AI 시대에 PRD를 작성한다는 것은 어떤 의미인가, 그리고 그렇게 작성한 PRD를 중심으로 AI 에이전트를 활용해 개발하며 겪은 일을 말해 보겠습니다.",https://yozm.wishket.com/magazine/detail/3221/
plan,"‘큐레이션’ 하나로 고객 경험을 바꿀 수 있을까? 6분 2025.05.27. 이커머스는 판매와 소비라는 두 가지 측면에서 시대감각과 밀접하게 닿아있다. 특히 트렌드와 높은 감도에 익숙한 고객에게 매끄러운 경험을 제공하지 못한다면 실망감만 안겨줄 뿐이다. 여기에 프로젝트를 진행하면서 맞닿는 다양한 이슈와 수많은 이해관계자와 나온 결과물이 고객 맥락이나, 이용 행태를 제대로 반영하지 못한다면 더욱 외면받게 될 것이다. 이러한 이유로 이커머스에서는 고객을 온전히 이해하고 그들의 경험을 지지하도록 유도하는 큐레이션이 더욱 중요해졌다. 이번 글에서는 큐레이션으로 고객 만족도를 높일 수 있는 기획 방법과 사례에 대해 살펴보고자 한다.",https://yozm.wishket.com/magazine/detail/3151/
plan,"카카오 T에서 ‘심야주차권’을 3분 빨리 쓰면 벌어지는 일에 대하여 10분 2025.05.22. 17시가 다 되어가는 것을 확인하고는 차량을 이동해 예약한 주차장으로 향했습니다. 입차 과정이 5분은 넘을 거라고 생각했는데, 너무 효율적으로 이동한 탓에 2~3분 만에 다음 건물에 들어서 버리게 되었습니다. 그렇게 문제의 사건이 일어나버렸습니다. 17시부터 이용할 수 있는 심야 주차권으로 16시 57분(16시 47분 30초 정도)에 입차했고, ‘뭐 2~3분 정도야 버퍼로 처리되겠지’ 안일하게 생각했던 저의 예상을 비웃듯 아무런 알림이나 통보 없이 상품이 강제 취소되어 버린 것입니다.",https://yozm.wishket.com/magazine/detail/3139/
plan,구글 직원은 왜 ‘구글러’일까? 커뮤니케이션 브랜딩의 힘 9분 2025.05.01. 커뮤니케이션 브랜딩이란 우리 조직을 구성하는 구성원들 혹은 우리 사용자나 소비자들이 브랜드의 접점에서 느끼게 될 주요한 단어들을 브랜딩 하는 일입니다. 쉽게 말해 자칫 남들과 똑같아질 수 있는 포인트를 어떻게 하면 우리만의 정체성과 경험으로 가져올 것인가에 대한 문제죠. ‘때로는 단어 하나가 새로운 문화를 만든다’라는 영국의 유명 인류학자 케이트 폭스(Kate Fox)의 말처럼 좋은 브랜드를 오래 유지하기 위해서는 이 브랜드의 구석구석을 잘 조여주는 볼트와 너트 같은 언어들이 필요한 법입니다.,https://yozm.wishket.com/magazine/detail/3102/
plan,"AI로 묻고 답하는 설문조사 툴 ‘Theysaid’ 6분 2025.04.17. 제가 PM으로 일하면서 주기적으로 진행하는 업무 중 하나는 유저 리서치입니다. 그중에서도 설문조사는 정량 조사의 방법으로 다양한 목적에 따라 자주 활용하고 있는데요. 최근에는 AI의 도움으로 설계에 드는 시간이 어느 정도 줄어들긴 했습니다. 하지만 여전히 처음에 어떤 방향으로 질문을 구성할지, 또 질문의 의도에 맞춰 어떤 응답 유형을 선택해야 좋을지 고민이 많습니다. 오늘은 이러한 상황에서 도움이 될 만한 서비스를 소개하고자 합니다. 설문 제작부터 응답과 분석 과정 전반에 걸쳐 인공지능을 적극적으로 활용할 수 있는 ‘Theysaid’입니다.",https://yozm.wishket.com/magazine/detail/3070/
plan,"생각만으로 글 쓰는 시대 올까? 뇌-컴퓨터 인터페이스 혁명 10분 2025.04.15. 생각만으로 타이핑을 하고, 말을 하지 않아도 컴퓨터를 제어할 수 있다면 어떨까요? 메타(Meta)의 뇌-컴퓨터 인터페이스(BCI) 연구는 이 놀라운 가능성을 현실로 바꾸고 있습니다. 비침습적 기술과 AI 기반 신호 해독을 통해, 인간과 디지털 세계의 경계가 허물어지고 있습니다.",https://yozm.wishket.com/magazine/detail/3067/
plan,"프로젝트보다 ‘프로덕트’ 중심 마인드셋이 중요한 이유 8분 2025.03.28. 현재 전 세계 대부분의 프로젝트 매니저들, 특히 5~10년 전에 교육받은 사람들은 여전히 아이언 트라이앵글(범위, 시간, 예산)의 관점에서 세상을 보고 있습니다. 프로젝트 매니저들은 이 삼각형이 작동하게 하려고 공식적인 의사결정을 활용해 각 요소의 위치를 조정합니다. 시간이 부족하면 예산을 늘리거나 범위를 줄이거나, 혹은 둘 다 조정합니다. 하지만 이러한 사고방식은 현대적인 제품 개발에서는 문제가 됩니다. 각 요소를 크게 조정하더라도 가치 또는 혜택을 달성하지 못할 가능성이 매우 크기 때문입니다.",https://yozm.wishket.com/magazine/detail/3039/
plan,"왜 잘나가는 기업은 ‘인터널 브랜딩’부터 챙길까? 8분 2025.03.20. 회사 조직의 문화, 제도, 인재상과 경영방식에 이르기까지 회사 내부를 브랜딩하는 일련의 행동을 바로 ‘인터널 브랜딩(internal branding)’이라고 부릅니다. 좋은 브랜딩 활동을 위해 혹은 기업의 문화나 제도 자체를 더 나은 방향으로 설계하기 위해, 회사 내부에서부터 명확한 브랜드 DNA를 갖도록 하는 것이 바로 인터널 브랜딩이죠. 이번 글에서는 앞으로 더욱 중요해질 것으로 보이는 ‘인터널 브랜딩’에 대해 알아보고, 이를 둘러싼 몇 가지 오해들도 해소해 보고자 합니다.",https://yozm.wishket.com/magazine/detail/3024/
plan,"초개인화 승부수 띄운 ‘네이버플러스 스토어’ 전략 통할까? 6분 2025.03.19. 지난 3월 12일, 네이버는 ‘네이버플러스 스토어’(이하 네이버+ 스토어)를 새롭게 출시했다. “초개인화 쇼핑 경험”이라는 슬로건에서 알 수 있듯, 기존과 다른 AI 기반의 차세대 쇼핑을 지향하고 있다. 가장 큰 특징은 목적형 쇼핑을 중심으로 검색 비중이 높은 쿠팡과 달리, 네이버는 ‘추천’ 영역을 대폭 확대하고 ‘발견’이라는 새로운 코너를 신설하여, 자연스럽게 상품을 탐색하는 경험을 강화했다는 점이다. 이번 글에서는 새롭게 선보인 네이버+ 스토어를 직접 이용해 보며, 서비스의 주요 특징과 개선점 등을 살펴보고자 한다.",https://yozm.wishket.com/magazine/detail/3023/
plan,"더 성장하고 싶은 IT인을 위한 추천 도서 11권 7분 2025.03.17. 인기 저는 17년 차 PM으로 책을 다독하기보다는 정독하는 편입니다. 주요 내용을 마인드맵으로 정리한 후, 저만의 관점과 생각을 담아 다시 한번 내용을 정리하는 독서법을 선호합니다. 완독까지는 시간이 꽤 오래 걸리지만, 이렇게 정리한 책은 장기기억으로 잘 안착하며, 이전에 기록했던 노트들과 맥락이 연결될 때는 짜릿한 즐거움도 느낍니다. 좋은 책은 여러 번 반복해 읽기도 하죠. 이번 글에서는 제가 작년에 읽고 정리했던 11권의 책을 소개하고자 합니다. 일을 더 잘하고 싶은, 성장을 꿈꾸는 IT업계 기획자, 실무자들에게 도움이 되길 바랍니다.",https://yozm.wishket.com/magazine/detail/3018/
plan,"프로젝트 매니저도 AI에 일자리를 빼앗길까? 8분 2025.02.21. 프로젝트 매니저로 일하는 저 역시, 개발자들의 AI 발전에 대한 우려를 현실에서 느끼고 있습니다. 프로그래밍에 익숙하지 않은 지인들이 챗GPT로 개인 홈페이지를 만들었다는 이야기를 듣기도 하고, 더는 코딩 없이 자연어 명령만으로 특정 서비스를 실행할 수 있다는 흥미로운 세션을 접하기도 했습니다. 또한, 유튜브와 기사에서도 별다른 IT 지식 없이 원하는 웹페이지나 기능의 코드를 챗GPT로 생성하는 사례를 봤습니다. 그만큼 개발자들과 오랜 시간 함께 일해 온 사람으로서, 이러한 변화는 제 커리어의 미래에 대해서도 고민해 보는 계기가 되었습니다. 그렇게 문득 궁금해졌습니다. 앞으로 나는 누구와 일하게 될지, 내 역할도 AI로 대체될 수 있을지 말이죠.",https://yozm.wishket.com/magazine/detail/2987/
plan,"기능 성공 지표, 정말로 측정하고 있나요? 10분 2025.02.14. 사실 대부분의 팀은 기능의 성공 지표를 단순한 형식적 절차로 취급합니다. 측정 방식을 논의하고 마지못해 기획서에 몇 가지 지표를 적어 두지만, 결국 실제 데이터는 한 번도 들여다보지 않죠. 우리는 보여주기식 성과 측정에 갇혀 있습니다. 성공을 측정하는 척하지만, 실제로는 그저 형식적인 절차를 밟을 뿐입니다. 그러나 우리는 이 악순환에서 벗어날 수 있습니다.",https://yozm.wishket.com/magazine/detail/2975/
plan,"아하 모먼트가 아닌 ‘아 모먼트’를 발견하다 4분 2025.01.30. 아하 모먼트는 신규 유저가 처음으로 제품의 가치를 느낀 순간을 의미하는데요. 이것이 잔존율에 큰 영향을 주는 만큼 아하 모먼트를 얼마나 빠른 시점에 잘 느낄 수 있게 만드느냐가 신규 유저 온보딩 여정의 핵심이 되곤 합니다. 그런데 지난 분기 저희 팀은 저희 온보딩 여정에 아하 모먼트가 아닌 아 모먼트가 존재하고 있다는 것을 깨닫게 되었습니다. 여러 유저 관찰 카메라를 진행해 본 결과, 아하 모먼트 발굴 이전에 아 모먼트 제거가 절실하다는 것을 느꼈죠.",https://yozm.wishket.com/magazine/detail/2953/
plan,"2025 이커머스 UX/UI 트렌드와 전략 살펴보기 7분 2025.01.22. 빠르게 변화하는 시장 속, 2024년 국내 이커머스 업계에서는 어떤 일들이 있었을까? 먼저 G마켓과 알리바바가 합작해 글로벌 시장 진출을 위한 기반을 다졌다. 네이버와 무신사는 AI 기반 추천 서비스로 괄목할 만한 성과를 이루었고, 컬리는 멤버십 혜택을 개편하는 등 고객 유치를 위한 다양한 노력이 이어졌다. 이러한 흐름을 바탕으로, 이번 글에서는 2025년 이커머스 시장의 UX/UI 트렌드와 전략을 살펴보고자 한다.",https://yozm.wishket.com/magazine/detail/2945/
plan,"급한 불 끄느라 바쁜 조직에서 벗어나는 법 11분 2025.01.13. 1부 ‘급한 불 끄기 바쁜 프로덕트의 문제점’에서는 프로덕트 조직에서 나타나는 위험 신호에 대해 이야기하며, 주로 문제점에 초점을 맞췄습니다. 이번 글에서는 이러한 문제를 해결하기 위한 전략과 전술에 대해 다루고자 합니다.",https://yozm.wishket.com/magazine/detail/2929/
plan,"급한 불 끄기 바쁜 프로덕트의 문제점 9분 2025.01.13. 인기 모든 회사에는 사람들이 처리할 수 있는 시간보다 더 많은 문제가 존재합니다. 작은 문제를 간과할 수 있는 환경에서는 최선의 결과가 나올 수 있습니다. 하지만 최악의 경우, 계속해서 긴급한 문제에만 대처하느라 운영에 필요한 자원이 고갈되고 맙니다. 매니저와 엔지니어들은 하나의 과제를 끝내지도 못한 채 다음 문제로 뛰어들게 되죠. 1부에서는 잘못된 프로덕트 문화의 증상을 다루며, 조직이 흔히 겪을 수 있는 주요 문제들을 살펴보고자 합니다.",https://yozm.wishket.com/magazine/detail/2928/
plan,"CPO에게 신탁을 의뢰하지 마세요 10분 2024.12.26. 기우제를 지내면 비가 내립니다. 왜 그럴까요? 비가 내릴 때까지 지내기 때문이지요. 아무 때나 신전에 가서 기우제를 지내자고 하면, 그들은 어떻게 대답할까요? “아직은 때가 아니다. 하늘이 허락하는 때를 기다려야 한다” 신탁이란 그래서 아무렇게나 결정하면 안 되는 일입니다. 하지만 제품에서의 의사결정이란 일 년에 한 번 지내는 기우제가 아닙니다. 시시각각으로 결정해야 할 정책들이 배출되고 있고, 그 분야에 아주 경험이 많은 CPO라고 해도 그것을 아무 때나 결정하고 시작할 수 없습니다. 더 큰 문제가 있습니다. 일단 어떻게든 신탁을 의뢰하면, 이제 어느 누구도 신탁이 내리기 전에는 움직일 수 없다는 것입니다. CPO는 우리 제품의 미래를 점지하고 모든 의사결정을 대신 해주는 사람이 아닙니다.",https://yozm.wishket.com/magazine/detail/2906/
plan,"요즘IT에 쓰는 100번째 글: “나도 개발자가 읽는 글을 쓰고 싶다!” 12분 2024.12.20. 내가 요즘IT에 연재 글을 올린 지도 거의 4년이 되어간다. 2021년 3월부터 시작해 한 달에 최소 한 편, 많을 때는 4편 이상 연재하며 글을 차곡차곡 쌓아왔다. 평소 관심이 많은 프로덕트 관련 글을 주로 썼고, 기획이나 비즈니스 내용도 다뤘다. 비개발자이지만 개발 글도 몇 개 올렸다. 그리고 이번 글이 나의 요즘IT 100번째 글이 된다. 지금까지 써온 글의 제목을 주욱 살펴보니 망한 것도 많았고, 인기 글에 오른 것도 여럿 있었다. 이번 글에서는 글을 연재해 오면서 얻은 데이터, 노하우, 생각을 정리해 나눠보고자 한다. 결론부터 살짝 스포 하자면, 글을 잘 쓰는 것보다는 꾸준히 쓰는 것이 더 중요하다. 적어도 내 전략은 그렇다.",https://yozm.wishket.com/magazine/detail/2899/
plan,"갑자기 지표가 하락했을 땐 어떻게 해야 하나요? 6분 2024.12.19. 제품 기획부터 탄생까지 모든 여정을 책임지는 PM/PO에게는 수많은 자질이 요구된다. 그중 하나는 프로덕트에 문제가 발생했을 때 빠르게 원인을 파악하고 대처하는 능력이다. 우리는 제품의 개선과 안전을 책임지기 위해 정량적 잣대인 ‘지표(Metric)’를 설정하고 이를 개선하기 위해 OKR, KPI 등을 설정한다. 하지만 지표라는 것이 마치 드라마처럼 상승 곡선만 그리며 성공하는 것이 아니다. 안타깝게도 제품이 운영되고 고도화되는 과정에서 예기치 못한 이슈가 발생하고, 이를 측정하는 지표가 갑작스럽게 하락하는 경우가 자주 발생한다. 필자 또한 현업에서 수많은 지표를 담당했고 수차례 하락 이슈를 경험했다. 그 과정에서 많은 배움을 얻고 대처 방법을 터득했기에, 그 내용을 현직 PM/PO와 예비 종사자에게 전해보고자 한다.",https://yozm.wishket.com/magazine/detail/2898/
plan,"브랜드 슬로건, 어떻게 정해야 할까? 10분 2024.12.17. ‘슬로건’이라는 단어가 어디서 유래되었는지 아시나요? 슬로건이라는 말은 유럽의 켈트족이 주로 사용하던 언어인 게일어에서 유래된 단어인데요. 과거 스코틀랜드 지역의 군대가 전쟁에서 자신들의 힘을 드러내기 위해 외치던 ‘Sluagh-ghairm(슬로어-가함)’이라는 말에서부터 시작되었다고 합니다. 같은 편인 사람들을 하나로 모으고, 공통된 목적의식을 갖게 하는 역할이 이 슬로건이란 단어 속에 담겨있었다는 걸 알 수 있는 대목이죠. 이번 글에서는 이러한 ‘슬로건’을 우리 브랜드에 적용할 땐 어떤 과정들이 필요한지 살펴보고자 합니다.",https://yozm.wishket.com/magazine/detail/2894/
plan,불황도 이겨내는 이커머스별 ‘딜 큐레이션’ 전략은? 6분 2024.11.21. 이커머스가 선보이는 ‘딜’은 고객 유입과 매출 증가에 중요한 전략으로 활용된다. 대신 신뢰를 줄 수 있는 상품을 좋은 가격과 혜택으로 소개해야 효과를 얻을 수 있다. 이번 글에서는 불황 소비에 걸맞는 이커머스 딜 큐레이션을 어떻게 효과적으로 제공할 수 있을지 알아보고자 한다.,https://yozm.wishket.com/magazine/detail/2857/
plan,"PM의 ‘진짜 성장’은 언제 올까? 9분 2024.11.20. PM이 성장하는 지점에 대해 정확하게 설명하기 위해 역설적으로 접근하려고 합니다. “우리가 어떤 상황에 놓여 있다면 성장 지점에 도달하지 못하는가, 왜 PM으로서 성장하지 못할 것이라고 생각하는가”에 대해 얘기해 보기로 합시다. PM의 성장은 제품 개발 프로세스 전반부에 뿌려둔 씨앗으로 후반부에서 결실을 맺을 때, 그 수확과 함께 이루어집니다. 무엇보다 숙련되어 가는 것과 성장하는 것이 다르다는 얘기를 하고자 합니다. 언제 어디서나 그렇겠지만, 개인도 숙련되는 것만으로는 만족할 수 없고 조직도 숙련되는 것만으로는 충분히 행복할 수 없습니다. 단순한 숙련과는 다른 차원에서 성장의 기회는 필수적이어야 합니다.",https://yozm.wishket.com/magazine/detail/2855/
plan,"성장하지 못하는 PM의 착각 9분 2024.11.20. 인기 이번 글은 PM이 성장하는 지점에 대해 정확하게 설명하기 위해 역설적으로 접근하려고 합니다. “우리가 어떤 상황에 놓여 있다면 성장 지점에 도달하지 못하는가, 왜 PM으로서 성장하지 못할 것이라고 생각하는가”에 대해 얘기해 보기로 합시다. 누군가 “우리의 삶은 RPG 게임이 아닌데, 꼭 성장을 해야만 하는가”라고 반문할 수도 있습니다. 물론 어떠한 애니메이션이나 게임들처럼 꼭 성장이 없더라도 얼마든지 모험을 즐길 수 있죠. 하지만 성장하는 시점을 발견하고, 또 제품을 산출하는 즐거움을 느껴보는 것 역시 아주 큰 경험이 될 수 있습니다. 글은 제품 개발 프로세스의 전반부와 후반부로 나누었습니다. 1편은 제품의 형상화와 코덱, 2편은 제품의 산출과 PM의 성장을 다뤄보겠습니다.",https://yozm.wishket.com/magazine/detail/2854/
plan,"‘가치’에 집중하는 PM이 성공하는 이유 7분 2024.11.15. 프로덕트 매니저(이하 PM)가 ‘로드맵’이라는 단어보다 더 자주 쓰는 말이 있다면, 아마도 ‘가치’일 것입니다. 예를 들어, 고객 가치, 비즈니스 가치, 가치 제안, 가치 흐름, 가치 창출 등이 있죠. 하지만 많은 PM들이 자신이 회사에 제공할 가치나 그 가치를 극대화할 방법에 대해서는 충분히 고민하지 않습니다. PM에게는 개발, 영업, 마케팅, 경영진 등 여러 부서의 다양한 요구가 쏟아집니다. 이러한 상황에서 자신이 맡은 일을 근본적으로 어떻게 개선할 수 있을지, 또 회사에 필수적인 존재로 어떻게 자리 잡을 수 있을지 제대로 평가해 볼 여유가 없습니다. 그렇다면 이 역할을 잘 수행하기 위한 핵심 요건은 무엇일까요? 제품에 대한 올바른 결정을 내리고, 조직 전체가 제품을 성공적으로 마케팅, 판매 지원할 수 있도록 하려면, PM은 무엇을 해야 할까요?",https://yozm.wishket.com/magazine/detail/2848/
plan,"현상과 문제를 제대로 구분하고 있나요? 5분 2024.11.14. 기획자의 모든 업무는 해결할 문제를 배경으로 시작하게 된다. 명확한 문제가 있어야 해결이라는 목표가 성립되며, 방향성을 더 견고하게 설정할 수 있다. 그러나 현업에서 안타깝게도 명확한 문제가 배경이 아닌 상태로 기획이 시작되는 경우가 종종 있다. 이번 글에서는 기획의 시작이 ‘명확한 문제’가 되어야 하는 이유와 명확한 문제를 찾는 방법을 이야기해 보려고 한다.",https://yozm.wishket.com/magazine/detail/2846/
plan,"좋은 네이밍을 위한 체크리스트 9분 2024.11.11. 혹시 여러분이 하는 일 중 가장 즐겁고 재미있는 일을 하나 꼽으라면 무엇이 떠오르시나요? 저에겐 ‘네이밍’이라는 영역이 그렇습니다. 사실 네이밍은 브랜딩을 하는 사람들이 의외로 기피하는 업무이기도 합니다. 다들 아시다시피 이름을 정한다는 건 앞으로 많은 사람들에게 수없이 불릴 특정 단어를 만드는 일임과 동시에, 브랜드의 가장 중요한 핵심 이미지와 속성을 전달하는 일입니다. 게다가 네이밍은 한 번 결정하면 다시 변경하는 것이 거의 불가능에 가깝죠. 그래서 네이밍은 부담과 책임이 막중한 영역입니다. 이번 글에서는 좋은 네이밍이란 무엇인지, 체크리스트를 통해 살펴보고자 합니다.",https://yozm.wishket.com/magazine/detail/2840/
plan,"툴 서비스의 무료 AI 기능, 사용자 경험은 어떨까? 7분 2024.11.05. 생성형 AI와 툴 서비스는 사용자가 작업 목표를 쉽고 편리하게 달성할 수 있도록 돕는 공통적인 가치를 제공합니다. 현재 많은 툴 서비스에서 AI 기능을 붙여, 사용자가 더 쉽게 작업을 완료할 수 있게 해 서비스 진입장벽을 낮추고 있습니다. 특히 AI를 활용해 다양한 초안을 생성하거나, 작업에 대한 피드백을 제공함으로써 더욱 고도화된 결과물을 만들 수 있죠. 이번 글에서는 디자인 툴과 웹/앱 제작 분야의 툴 서비스가 제공하는 무료 AI 기능이 어떤 사용자 경험을 제공하는지 살펴보겠습니다.",https://yozm.wishket.com/magazine/detail/2830/
plan,"UX 리서처와 데이터 사이언티스트가 함께 일하는 법 9분 2024.10.23. UX 리서처와 데이터 사이언티스트는 무슨 일을 하나요? 두 직군의 역할을 머릿속에 바로 떠올리는 분들도 있을 겁니다. 하지만 제가 체감하기로는 일부 회사에서 UX 리서처가 mixed-method(혼합연구방법)로 역할을 확대하면서 경계가 모호해진 경우가 있습니다. 데이터 사이언티스트도 데이터 분석가, 비즈니스 분석가, 정량 리서처 등 조금씩 다른 이름과 역할로 규정되는 경우가 있고요. 둘은 소속 조직이 다른 경우가 많고 국내에서 UXR은 상대적으로 늦게 생긴 직군이다 보니, 두 직군이 협업할 때 어떤 시너지가 날지 예상하기 어려워하는 모습도 종종 보곤 했습니다. 이번 글에서는 화해 UX 리서처가 협업하는 여러 직군 중, 데이터 사이언티스트(a.k.a DS)와 협업하는 상황과 사례를 소개해 보려고 합니다.",https://yozm.wishket.com/magazine/detail/2813/
plan,"이커머스에서 고객 지표 이해하는 법 (feat. 태블로) 6분 2024.10.22. 태블로(Tableau)는 데이터를 연동해 지표를 시각화하여 분석하는 툴이다. 특히 이커머스에서 태블로를 활용하면, RFM(Recency, Frequency, Monetary), 최근 구매 시기, 구매 빈도, 총구매 금액을 기반으로 분석하거나, 코호트 분석에도 활용하는 등 고객 지표를 확인하는 데 도움이 된다. 이번 글에서는 이커머스 고객 분석 지표에는 무엇이 있는지 살펴본 후, 태블로를 이용해 분석하는 방법을 소개하고자 한다.",https://yozm.wishket.com/magazine/detail/2810/
