category,title,url
design,"Chill한 하루, 우리는 정말 초개인화 시대에 살고 있을까? 7분 2025.02.20. 아침에 눈을 뜨자마자 유튜브는 내게 딱 맞는 영상을 추천해 주고, SNS 피드에는 마치 내 생각을 읽은 듯한 콘텐츠가 가득합니다. 쇼핑몰은 내가 좋아할 만한 제품을 먼저 보여주고, 음악 앱은 취향에 맞춘 플레이리스트를 자동으로 만들어 줍니다. 우리는 언제부터 이렇게 초개인화된 세상에 살게 된 것일까요? 하지만 흥미롭게도, 우리는 여전히 모두가 같은 유행어를 쓰고 비슷한 밈을 공유하며 웃고 있습니다. 내게 맞는 콘텐츠만 나온다지만, 유행하는 밈도 등장하는 초개인화 시대의 추천. 이 초개인화란 무엇이며, 어떻게 등장하고 발전해 온 것일까요? 앞으로 우리의 경험은 AI 발전과 더불어 어떤 방향으로 변화하게 될까요?",https://yozm.wishket.com/magazine/detail/2985/
design,"맨땅에 헤딩하는 개발자와 창업가를 위한 3가지 피그마 활용법 9분 2025.01.23. 디자인은 해본 적 없는 사람에게는 낯설고 막막하게 느껴지기 마련입니다. 특히 사이드 프로젝트를 꿈꾸는 개발자나 1인 창업자라면, 디자인을 잘 몰라도 프로젝트를 시작해야 할 때가 많죠. 그럴 때면 아이콘, 버튼, 레이아웃 같은 기본적인 요소조차 큰 고민거리로 다가옵니다. 걱정하지 마세요. 맨땅에 헤딩하지 않고도 피그마(Figma)를 잘 쓰면 어려움을 한층 쉽게 해결할 수 있습니다. 개발자와 창업자가 피그마를 활용해 디자인 작업을 효율적으로 해결할 방법들을 소개하려 합니다. 피그마 기초 튜토리얼보다는 효과적으로 활용하는 방법에 초점을 맞추어 라이브러리, 플러그인, 커뮤니티 3가지 영역의 활용법 등을 다뤄 보겠습니다.",https://yozm.wishket.com/magazine/detail/2946/
design,"UX 디자인에 참고하기 좋은 레퍼런스 서비스 2가지 6분 2025.01.21. 최근에 주니어 PM, 프로덕트 디자이너분들과 스터디를 진행하며, 가장 많이 받았던 질문 중 하나가 ‘레퍼런스를 어떻게 찾아서 업무에 활용하나요?’였습니다. 오늘은 UX 디자인에서 화면 그 이상의  도움을 얻을 수 있는 레퍼런스 제공 서비스 두 가지를 소개하고자 합니다. 첫 번째로 ‘abtest.design’은 실제로 진행된 A/B 테스트 사례를 제공하는 서비스이고, 두 번째로 ‘FirstVersion’은 프로덕트 헌트, 유튜브, 이베이 등과 같은 서비스의 초기 버전과 관련된 이야기를 확인할 수 있는 서비스입니다.",https://yozm.wishket.com/magazine/detail/2942/
design,웹 접근성을 위한 ‘텍스트 컬러 시스템 가이드’ 만들기 15분 2025.01.08. 인기 디자이너로서 디자인 시스템이 왜 중요한지 고민하던 때가 있습니다. 이번 글에서는 컬러 시스템 중 ‘Gray scale’을 정리해 보았습니다.,https://yozm.wishket.com/magazine/detail/2921/
design,"나를 닮은 AI로 요즘IT 사용자 인터뷰하기 11분 2025.01.03. AI는 사용자와의 대화에서 생각보다 많은 것을 파악하고 있다. 최근 연구에서는 단 2시간만 대화해도, AI가 인간 사용자와 80% 이상 유사한 의사결정을 내리거나 성격 테스트를 수행할 수 있다는 결과가 나왔다. AI가 인간과 나눈 대화 데이터를 기반으로 사용자의 성격, 성향, 가치관을 복제할 수 있다는 의미다. 그렇다면 지금까지 GPT와 대화한 내용을 토대로 내 디지털 트윈(Digital Twin)을 만들어, 이를 대상으로 사용자 인터뷰를 진행해 보면 어떨까? 과연 나와 비슷한 생각을 이야기할까?",https://yozm.wishket.com/magazine/detail/2915/
design,"디자인 시스템은 디자인이 아닙니다 8분 2025.01.02. 인기 바야흐로 디자인 시스템의 시대다. UX/UI를 조금이라도 다뤄본 사람이라면 디자인 시스템을 모르는 경우가 드물고, 실제로 경험해 본 사람도 많아졌다. 이제는 신입 디자이너의 포트폴리오에서도 디자인 시스템 작업이 포함된 사례를 흔히 볼 수 있다. 디자인 시스템이 디자이너의 필수 코스가 된 이유는 단연 피그마의 등장과 발전 덕분이다. 피그마는 디자이너의 업무 방식을 짧은 시간 안에 급격히 바꿔놓았다. 불과 3~4년 전만 해도 포토샵이나 일러스트레이터로 웹디자인을 하던 나로서는, 지금처럼 개선된 디자인 환경이 반갑기도 하지만 한편으로는 갈수록 도구를 다루는 테크니션으로서의 디자이너만 양산되는 듯한 현실에 아쉬움이 남는다. 이번 글에서는 디자인 시스템을 왜 ‘디자인’이라고 보기 어려운지, 그 이유와 생각을 정리해 보고자 한다.",https://yozm.wishket.com/magazine/detail/2914/
design,"웹 접근성 명암비 기준, 꼭 지켜야 할까? 8분 2024.12.23. 웹 접근성은 서비스가 다양한 사용자의 요구에 맞춰 설계되어 있는지 여부를 평가하는 중요한 요소입니다. 그중 명암비는 ‘텍스트와 배경 간의 대비’를 나타내며, 이는 사용자가 콘텐츠를 읽고 이해하는 데 큰 영향을 미치는 중요한 고려 대상입니다. 하지만 디자인을 하다 보면 웹 접근성을 준수하는 것이 항상 쉬운 일은 아니라는 점을 알게 됩니다. 이번 글에서는 실제 서비스에서의 웹 접근성과 명암비 적용 사례를 분석했습니다. 토스, 당근, 네이버, 유튜브, 애플, 순서대로 5가지 상용 서비스의 명암비를 분석하고, 이를 기반으로 웹 접근성 디자인 전략의 중요성과 그 방법에 대해 다루고자 합니다. 디자이너와 개발자가 웹 접근성을 이해하고 적용하는 데 도움이 되기를 바랍니다.",https://yozm.wishket.com/magazine/detail/2901/
design,"AI로 맥도날드 키오스크 사용자 인터뷰하기 (w. Synthetic Users) 12분 2024.12.17. 만약 AI로 가상의 사용자를 만들어 인터뷰를 진행하면 어떤 결과를 얻을 수 있을까? 이번 글에서 사용할 AI 도구는 ‘Synthetic Users’이다. Synthetic Users는 여러 GPT 도구로 나누어 진행했던 가상 인터뷰와 분석 과정을 한 번에 처리할 AI 도구이다. 인터뷰 질문과 결과를 자동으로 생성하고 분석해 보고서를 제공해 빠르고 간편하게 결과를 볼 수 있다. AI를 사용하면 모두 시간과 비용을 크게 절감할 수 있는 효과적인 방법이다. 실제 사용자 인터뷰는 인터뷰 목적 및 질문지 설계, 파일럿 인터뷰, 참여자 모집과 보상 계획, 인터뷰 진행, 결과 분석 등 상당히 많은 시간과 비용이 필요하기 때문이다.

그러나 AI는 인간 사용자가 아니다. 그 때문에 인터뷰 결과를 완전히 신뢰할 수 없다는 한계가 있다. 또한, 속도와 편리함이 중심인 인터뷰 방식인 만큼 이를 실제 사용자 인터뷰의 대안으로 사용할 경우, 윤리적 문제를 고려해야 한다. 이를 방지하려면 윤리적인 AI",https://yozm.wishket.com/magazine/detail/2893/
design,"4가지 GPTs로 ‘사용자 인터뷰’ 시뮬레이션하기 7분 2024.12.10. 사용자를 이해하기 위한 다양한 리서치 방법론이 있다. 사용자와 인터뷰를 진행하여 인사이트를 도출하는 방법은 그중에서도 대표적이다. 만약 AI로 가상의 사용자를 만들어 인터뷰를 진행하면 어떤 결과를 얻을 수 있을까? 이에 대해 알아보고자 직접 AI와 가상 인터뷰를 수행한 다음, 이를 정리해 보았다. 구체성을 더하기 위해 여러 가지 AI 도구를 사용하여 ‘맥도날드 키오스크 사용자’의 페인 포인트를 찾는 것을 목적으로 했다. 이번 글에서는 GPTs를 사용하여 퍼소나를 생성하고, 인터뷰를 진행한 다음, 분석한 방법을 각각 소개한다.",https://yozm.wishket.com/magazine/detail/2883/
design,"디자인으로 수십억 원을 절약한 방법(feat. 결제 시스템) 8분 2024.12.06. 디자인은 ‘있으면 좋은 것’ 정도가 아닙니다. 특히 결제 시스템에서의 현명한 디자인 결정이 얼마나 큰 재정적 영향을 줄 수 있는지 보여주는 사례 연구가 있습니다. 중요한 시스템에서 디자인이 부족하면 실수와 지연이 발생하고, 결국 사용자들이 불만을 가지게 됩니다. 아직도 많은 사람들은 디자인을 단순히 장식으로만 생각합니다. 디자인은 “있으면 좋은 것” 정도로 치부되며, 더 중요한 일이 끝난 후에나 고려해야 할 요소로 여겨집니다. 특히 기능성과 안정성이 우선시되는 ‘핀테크’에서는 더욱 그렇죠. 모든 결제 시스템이 거의 동일해 보이는 이유도 여기에 있습니다.",https://yozm.wishket.com/magazine/detail/2880/
design,"포토그래퍼 없이도 원하는 제품 사진 생성하는 ‘Flair’ 5분 2024.12.04. 최근 업무를 하며 제품 이미지가 필요할 때가 있는데, 이미지만 업로드해도 원하는 배경 등을 손쉽게 설정할 수 있는 서비스를 접할 수 있었습니다. 디자인에 드는 꽤 많은 시간을 단축할 수 있어서 편리했는데요. 여러 서비스 중에서 오늘은 AI와 템플릿을 활용해 전문적인 촬영, 편집 기술 없이도, 멋진 제품 사진을 얻을 수 있도록 도와주는 ‘Flair’를 알아보고자 합니다.",https://yozm.wishket.com/magazine/detail/2875/
design,"2025년, 주목해야 할 AI UX 트렌드 6가지 16분 2024.12.03. 인기 지난 2024년이 AI 기술의 가능성을 펼친 해였다면, 2025년은 AI와 UX 영역이 함께 사용자의 경험을 재정의하는 해가 될 것입니다. 이번 글에서는 AI 기술이 사용자 경험에 미치는 영향을 다양한 관점에서 조망해 보려고 합니다. 다가오는 2025년 주목해야 할 UX 전략과 방향성 역시 제시해 보겠습니다. 주요 IT 기업들의 AI 중심 전환 전략, 독립적인 에이전트의 부상, 디지털 정보의 신뢰성 확보와 주저 비용이 키워드입니다. 이러한 변화의 열쇠들이 사용자 신뢰와 상호작용에 어떤 영향을 미치는 지도 탐구해 보겠습니다. 또한, 인간과 AI의 협업 전략, 온-오프라인이 통합된 경험 설계, 그리고 AI 시대의 윤리적 과제까지 다각도로 살펴볼 예정입니다.",https://yozm.wishket.com/magazine/detail/2873/
design,"피그마는 정말로 실용적일까? 7분 2024.11.26. 인기 피그마는 이제 UX/UI 디자인의 필수 도구가 되었다. 현재 피그마의 독주 체제는 생각보다 더 강력하다. 나름 대항마로 등장했던 스케치와 어도비 XD는 처참할 정도로 시장 점유율을 빼앗긴 상태고, 개발자와 디자이너를 연결해 주던 다른 서비스도 피그마에 밀려 쇠락하거나 문을 닫았다. 물론 피그마가 UI 디자인 환경에 대격변을 가져온 것은 부정할 수 없다. 그만큼 피그마는 실용적이고, 디자이너의 업무 효율성을 높여주고 있다. 하지만 피그마를 실제로 사용하다 보면 아쉬운 점이 생각보다 많다. 이런저런 기능이 더 있으면 좋겠다는 수준을 넘어서, 도구 자체가 가진 한계에 더 가까운 것들이다. 이번 글에서는 필자가 직접 사용하면서 느낀 피그마의 개선점, 한계점을 공유해 보고자 한다.",https://yozm.wishket.com/magazine/detail/2862/
design,"거짓말쟁이 AI 잡아낼 4가지 ‘팩트 체크’ 방법 7분 2024.11.19. 챗GPT 메인 화면 하단을 보면 이런 메시지가 쓰여 있다. ‘ChatGPT는 실수를 할 수 있습니다. 중요한 정보를 확인하세요.’ 자세히 보지 않으면 쉽게 지나칠 만큼 작은 글씨로 쓰여있지만, 이는 사실 대규모 언어 모델을 사용할 때 가장 주의해야 하는 점이다. AI가 때로 사실이 아닌 정보를 그럴듯하게 꾸며내어 말하는 현상, LLM의 고질적인 문제인 할루시네이션 현상 때문이다. 따라서 AI의 답변이 사실인지 아닌지 확인하기 위해서는 근거나 출처를 직접 확인해 봐야 한다. 도구별, 상황별로 실행할 수 있는 여러 답변 검증 방법을 정리해 봤다.",https://yozm.wishket.com/magazine/detail/2852/
design,"나만의 OTT 비서 넷플릭스? 12분 2024.11.13. UX 디자인 방법론인 더블다이아몬드 기반으로 앱스토어 리뷰를 UX 모델링하고 디자인해 나가는 과정을 시리즈로 담고 있습니다. 과정마다 적합한 AI 도구를 소개하며 넷플릭스 리디자인을 진행합니다. 앞서 넷플릭스 앱스토어 리뷰가 최근 1년 사이 악화되고 있다는 것을 발견했습니다. 이어 개인화 부족, 공유 계정 정책의 혼란으로 구독 해지 위험이 증가하고 있다는 문제 역시 정의했습니다. 이에 따라 “사용자가 경험을 더 개인화하고, 친구들과의 연결 기능이 추가되면 콘텐츠 탐색의 불편함과 실망감을 줄일 수 있다”는 가설까지 설립했죠. 그럼 이번 글에서는 Develop, 개발하기와 Deliver, 전달하기 과정을 진행해 보겠습니다. 시작해 볼까요?",https://yozm.wishket.com/magazine/detail/2843/
design,"넷플릭스 앱 별점은 왜 이렇게 낮을까? 14분 2024.11.12. UX 디자이너에게 가장 중요한 덕목 중 하나는 사용자 피드백을 수집하고 분석하여 서비스를 개선하는 것입니다. 사용자들이 서비스에 의견을 남기는 방법은 여러 가지가 있는데요. 그중 앱스토어 리뷰는 플랫폼에 유저가 직접적으로 피드백을 남기는 공간으로, 앱 출시부터 누적된 방대한 양의 로우 데이터(Raw Data)가 쌓여있습니다. 이러한 앱스토어 리뷰 기반으로 넷플릭스 앱을 리디자인하는 과정을 시리즈로 준비했습니다. UX 디자인 방법론인 더블 다이아몬드(Double Diamond)를 따르며, 과정별로 그에 적합한 AI 도구들과 함께 진행해 보겠습니다.",https://yozm.wishket.com/magazine/detail/2841/
design,"UI와 프로토타입, 코드까지 생성해 주는 ‘Polymet’ 5분 2024.11.07. 인기 피그마(Figma)는 지난 6월 Config 2024에서 AI 기능 업데이트를 발표했습니다. 디자인 생성부터 이미지 처리, 텍스트 수정까지 자동화하여, 디자인 프로세스를 간소화할 다양한 기능을 소개했는데요. 아쉽게도 그중 ‘메이크 디자인(Make Design)’ 서비스를 7월 초 일시 중단했습니다. 그리고 피그마는 최근 ‘메이크 디자인(Make Design)’ 기능을 ‘First Draft’라는 이름으로 다시 공개했습니다. 그러나 피그마가 해당 기능을 재정비하는 사이, 텍스트로 화면을 설계할 수 있는 서비스가 여럿 주목받았는데요. 오늘은 최근 베타 서비스를 시작한 ‘Polymet’을 살펴보고자 합니다.",https://yozm.wishket.com/magazine/detail/2835/
design,"클릭 수를 줄인다고 좋은 UX가 될까? 11분 2024.10.30. 클릭 수 줄이기는 자칫 잘못하면 큰 문제를 일으킬 수 있습니다. ‘간결함’에 집중한 나머지 기본 기능조차 찾기 힘들게 만들어진 앱도 있죠. 마치 눈을 가리고 루빅스 큐브를 풀려고 하는 느낌이랄까요. 이처럼 모든 작업을 단 한 번의 클릭(또는 제로 클릭)으로 줄이려고 하면 확장성이 떨어집니다. 그러다 최종 상태는 결국 모든 콘텐츠를 하나의 페이지에 다 담고, 각각의 액션에 대한 버튼이 따로 달려 있는 이상한 상황이 되는 겁니다. 그래서 좋은 UX는 단순히 클릭 수를 줄이는 데 그치지 않고, 그 이상의 목표를 가지고 있어야 합니다.",https://yozm.wishket.com/magazine/detail/2822/
design,"UX 디자이너를 위한 ‘프롬프트 엔지니어링’ 방법 6가지 8분 2024.10.28. AI와의 커뮤니케이션이란, AI로부터 원하는 답변을 얻기 위해 프롬프트를 체계적으로 잘 작성하는 것부터 시작한다. 하지만 “무엇을 도와드릴까요?”라고 묻고는 명령만을 기다리는 빈 대화창을 보고 있으면 어떤 말로 시작할지 쉽사리 떠오르지 않는다. 정확하게 말하면 ‘어떤 방식으로 질문을 던져야 의도한 대로 답변이 나올지’ 예측하기가 어렵다. 실제로 프롬프트를 잘 작성하는 작업은 AI 도구를 제대로 활용하기 위해 가장 중요한 일이다. AI로부터 원하는 값을 얻기 위해 프롬프트를 체계적으로 작성하는 일, 이를 ‘프롬프트 엔지니어링’이라고 부른다. 이번 글에서는 UX 디자인 분야에 초점을 맞춰 프롬프트 엔지니어링 방법에 대해서 정리해 보았다.",https://yozm.wishket.com/magazine/detail/2818/
design,"AI로 하루 만에 ‘10대 전용 인스타그램’ 리디자인하기 10분 2024.10.21. 인기 지난 9월, 인스타그램은 18세 미만 사용자를 보호하고자 <인스타그램 10대 계정(Teen Accounts)>이라는 새로운 기능을 도입했습니다. 앞으로 모든 10대용 계정이 비공개 계정으로 전환될 예정입니다. 그에 따라 10대들의 인스타그램 사용 경험도 바뀔 것으로 보이는데요. 10대 계정의 비공개 전환이 이들의 SNS 경험을 어떻게 바꿀지 탐구해 보려고 합니다. 챗GPT(ChatGPT)와 피그마 AI 플러그인으로, 하루 만에 리디자인부터 검증까지 마친 과정을 공유합니다. 특히 민감한 사회적 이슈에 UX 디자이너가 AI 도구를 활용해 어떻게 혁신적으로 대응할 수 있을지 살펴보겠습니다. AI 디자인 접근법에 대한 구체적인 가이드도 함께 정리할게요.",https://yozm.wishket.com/magazine/detail/2808/
design,"AI 제품에서 UX 패턴 확인하는 ‘Shape of AI’ 4분 2024.10.07. 기존에 사용하던 서비스는 물론, 새롭게 등장하는 서비스에서 빼놓을 수 없는 기능이자 주제는 바로 AI입니다. 그만큼 거대한 흐름이 되었고 이를 잘 활용하지 못하는 서비스는 뒤처진다는 인상을 줄 수 있죠. 또한 사용자 경험에도 중요한 영향을 끼칩니다. 그러나 너무 많은 서비스와 기능이 쏟아져 나오면서, 최근에는 AI가 적용된 서비스에서 UX 패턴을 어떻게 적용하면 좋을지에 대한 논의도 활발한데요. 오늘 소개할 ‘Shape of AI’는 AI의 성장에 따라 사용자 경험은 어떤 영향을 받고 있으며, 어떻게 대응하면 좋을지 살펴볼 수 있는 서비스입니다.",https://yozm.wishket.com/magazine/detail/2789/
design,"숙제 같은 피드백, ‘디자인 챌린지’로 재미있게 풀기 5분 2024.10.04. 해야 할 일은 사라지지 않고 문제는 늘 많은데 ‘나도 이런 문제가 있으니 봐주세요’라고 이야기하면 얼마나 생산적인 피드백을 받을 수 있을까요? 심지어 그것이 처음 보는 제품이라면요? 피드백을 받으면 내가 생각하지 못한 힌트를 얻거나, 못 보던 문제를 발견할 수 있다는 것은 누구나 공감할 거라고 생각합니다. 하지만 피드백은 요청하는 사람도 주는 사람도 고려할 게 많은 복잡한 과정입니다. 요청하는 사람은 문제와 맥락을 적절히 설명해야 하고, 주는 사람은 충분히 이해하고 직접 해보거나 그것에 준하는 몰입이 필요합니다. 이번 글에서는 프로덕트 디자이너가 효과적인 피드백을 이끌어 냈던 방법에 대해 소개합니다.",https://yozm.wishket.com/magazine/detail/2788/
design,"UX 디자이너가 AI를 대하는 태도: 주니어 vs. 시니어 7분 2024.09.25. 작년부터 ‘생성형 AI를 활용한 UX 디자인 워크숍’을 수차례 진행하며 여러 가지 인사이트를 발견할 수 있었다. 그중에서도 특히 디자이너의 실무 경력 연차에 따라 AI를 활용하는 목적이나 인식 면에서 차이가 두드러지게 나타난다는 것을 발견했다. 비교하고자 하는 두 그룹은 각각 3년 차 이하, 6년 차 이상 경력을 가진 UX 디자인 관련 실무자들이다. 이를 편의상 주니어, 시니어 그룹으로 나누어 지칭한다. 이들이 새로운 도구인 생성형 AI를 사용할 때 어떤 어려움을 느꼈고 AI에 대한 인식은 어땠는지, 구체적으로 연차에 따라 어떤 차이점과 공통점이 있는지 상세하게 살펴보려고 한다.",https://yozm.wishket.com/magazine/detail/2778/
design,알아두면 쓸모 있는 ‘대체 텍스트’ 6분 2024.09.24. 대체 텍스트는 이미지와 같은 미디어 요소를 설명하는 데 사용합니다. 이전 글 ‘알아두면 쓸모 있는 웹 접근성’에서도 대체 텍스트에 대해 간략하게 설명했었는데요. 이번 시간엔 대체 텍스트의 중요성과 활용법에 대해 자세히 알아보겠습니다.,https://yozm.wishket.com/magazine/detail/2776/
design,"디자인 업무 효율 높이는 피그마 플러그인 추천 8가지 7분 2024.09.11. 1년 전 ‘알아두면 쓸모 있는 피그마 플러그인 추천 7가지’라는 글을 발행했다. 그리고 1년 사이에 피그마 사용 환경은 대대적으로 변했고, 더 많은 기능이 등장해 사용성이 개선됐다. 또한 ChatGPT 등 생성형 AI 등장 이후, 피그마 플러그인에 대한 관심이 더 많아졌고 진입 장벽은 낮아졌다. 이제 수많은 플러그인이 디자이너의 든든한 조수가 되어주고 있다. 이번 글에서는 문서화, 핸드오프 등 협업에 필요한 플러그인과 디자인 업무 효율을 높여주는 피그마 플러그인을 살펴보고자 한다.",https://yozm.wishket.com/magazine/detail/2757/
design,"나만의 AI ‘디자인 인턴’과 일하기 12분 2024.09.03. 인기 “디자이너들은 중간 과정을 공유하기 꺼리는 것 같다.” 이는 디자이너와 협업하는 다른 직군으로부터 자주 듣는 말 중 하나입니다. 디자이너들은 아이디어를 구체화하는 데 강점이 있는 만큼, 완성도가 낮은 작업물을 공유하기 부담스러워합니다. 그래서 ‘디테일’과 ‘완성도’에 더 집착하는 경향이 있습니다. 하지만 실무에서는 ‘완성도 집착 비용’을 간과할 수 없습니다. 이 글에서는 ‘빠른 제작’과 ‘적정한 완성도’라는 두 마리 토끼를 잡은 MVP 제품의 컨셉 디자인 과정을 소개하려고 합니다. 다른 도움 없이, 오직 나만을 위한 ‘AI 디자인 인턴’들이 작업에 함께할 예정입니다.",https://yozm.wishket.com/magazine/detail/2744/
design,"프로토타이핑 AI 툴로 넷플릭스 UI 리디자인하기 8분 2024.08.29. ChatGPT가 출시된 초창기에는 UI 디자인을 하기 직전 단계까지 생성형 AI를 활용할 수 있었다. 서비스의 문제를 분석하고 솔루션을 도출하는 과정에는 텍스트 투 텍스트(text-to-text) AI인 ChatGPT를, UI 시안을 생성할 때는 텍스트 투 이미지(text-to-image) AI인 미드저니를 사용하는 방식이었다. 그리고 실제로 프로토타입 디자인을 하는 작업은 온전히 인간의 몫이었다. 그러나 시간이 지나며 프로토타입을 생성하는 AI 도구도 점차 발전해 왔다. 이번 글에서는 프로토타입 디자인을 위한 AI 도구 선택의 폭이 넓어진 지금, 도구별 사용 방법과 결과물에 어떤 차이가 있는지 비교해 보고자 한다.",https://yozm.wishket.com/magazine/detail/2737/
design,"[디자인 프로세스] MVP는 정말 빠르고 쉬울까요? 5분 2024.08.06. 보통 MVP(Minimum Viable Product)라고 하면, 아래와 같은 자동차 이미지로 많이 알려져 있습니다. 자동차로 비유되는 이유는 ‘린 스타트업’이라는 책에서 에릭 리스가 운전을 비유하여 설명을 이어 나가기 때문인 듯합니다. 그렇다면 너도나도 만들고 싶어 하는 MVP는 과연 쉬운 방법일까요? 우리는 빠르게 MVP만 만들어 내면 될까요? 이번 글에서는 디자이너가 바라본 MVP에 관한 생각을 정리해 보았습니다.",https://yozm.wishket.com/magazine/detail/2705/
design,"합격률 높이는 디자이너 포트폴리오 작성법 9분 2024.08.05. 최근 UX/UI 디자이너에 대한 수요가 급증하면서, 포트폴리오의 중요성도 함께 커지고 있습니다. 포트폴리오 완성을 도와주는 학원도 있지만, 높은 비용이 부담스러울 수도 있습니다. 따라서 포트폴리오에 대한 새로운 시각을 가지고, 차별화된 포트폴리오를 구성해야 합니다. 특히 기업별, 도메인별로 적합한 포트폴리오를 제작하는 것이 중요해졌습니다. 이번 글에서는 UX/UI 디자이너의 합격률을 높이는 포트폴리오 작성법과 각 기업 및 도메인에 맞춘 차별화된 포트폴리오의 중요성에 대해 살펴보겠습니다.",https://yozm.wishket.com/magazine/detail/2703/
